{"schema_version":"person-detection-event/1.0","event_id":"00000000-0000-4000-8000-000000000001","input_id":"synthetic-camera-1","frame_id":"frame-000001","detected_at_utc":"2026-10-28T01:00:00Z","timestamp_source":"server_receive","image":{"width_px":640,"height_px":480},"model":{"name":"synthetic-segmentation-model","version":"1.0","weights_sha256":null},"detections":[]}
